{
    "$schema": "https://json-schema.org/draft-07/schema",
    "title": "Puzzle data specefication",
    "type": "object",
    "additionalProperties": false,
    "properties": {
        "$schema": {
            "type": "string"
        },
        "name": {
            "type": "string",
            "minLength": 1
        },
        "subtitle": {
            "type": "string"
        },
        "positions": {
            "type": "array",
            "items": {
                "$ref": "#/$defs/position"
            }
        },
        "colours": {
            "type": "array",
            "items": {
                "$ref": "#/$defs/colour"
            }
        },
        "solution": {
            "type": "array",
            "items": {
                "$ref": "#/$defs/solution"
            }
        }
    },
    "required": [
        "name",
        "subtitle",
        "positions",
        "colours"
    ],
    "$defs": {
        "position": {
            "type": "object",
            "additionalProperties": false,
            "properties": {
                "positions": {
                    "$ref": "#/definitions/positions"
                },
                "type": {
                    "$ref": "#/definitions/positionType"
                }
            },
            "required": [
                "positions",
                "type"
            ]
        },
        "colour": {
            "type": "object",
            "additionalProperties": false,
            "properties": {
                "e1": {
                    "$ref": "#/definitions/point"
                },
                "e2": {
                    "$ref": "#/definitions/point"
                }
            },
            "required": [
                "e1",
                "e2"
            ]
        },
        "solution": {
            "type": "array",
            "items": {
                "$ref": "#/definitions/positions"
            }
        }
    },
    "definitions": {
        "point": {
            "type": "string",
            "pattern": "[0-9]+,[0-9]+"
        },
        "positions": {
            "type": "string",
            "pattern": "^[0-9]+(-[0-9]+)?,[0-9]+(-[0-9]+)?$"
        },
        "positionCoordinate": {
            "type": "string",
            "pattern": "^[0-9]+(-[0-9]+)?$"
        },
        "positionType": {
            "type": "string",
            "pattern": "^NONE$|^(UP|DOWN|LEFT|RIGHT|BRIDGE|UPLEFT|UPRIGHT|DOWNLEFT|DOWNRIGHT)((\\s?(,|\\|)\\s?)(UP|DOWN|LEFT|RIGHT|BRIDGE|UPLEFT|UPRIGHT|DOWNLEFT|DOWNRIGHT))*$"
        }
    }
}