{
    "$schema": "../../../../puzzle.schema.json",
    "name": "28",
    "subtitle": "7x7",
    "positions": [
        {
            "positions": "0,0",
            "type": "LEFT | UP"
        },
        {
            "positions": "6,0",
            "type": "RIGHT | UP"
        },
        {
            "positions": "0,6",
            "type": "LEFT | DOWN"
        },
        {
            "positions": "6,6",
            "type": "RIGHT | DOWN"
        },
        {
            "positions": "0,1-5",
            "type": "LEFT"
        },
        {
            "positions": "1-5,0",
            "type": "UP"
        },
        {
            "positions": "6,1-5",
            "type": "RIGHT"
        },
        {
            "positions": "1-5,6",
            "type": "DOWN"
        },
        {
            "positions": "1-5,1-5",
            "type": "NONE"
        }
    ],
    "colours": [
        {
            "e1": "5,1",
            "e2": "3,3"
        },
        {
            "e1": "5,0",
            "e2": "1,6"
        },
        {
            "e1": "2,0",
            "e2": "4,3"
        },
        {
            "e1": "0,1",
            "e2": "3,2"
        },
        {
            "e1": "1,4",
            "e2": "0,6"
        },
        {
            "e1": "0,4",
            "e2": "5,5"
        },
        {
            "e1": "0,0",
            "e2": "3,1"
        }
    ],
    "solution": [
        [
            "3,3",
            "3-5,4",
            "5,1-3"
        ],
        [
            "5,0",
            "1-5,6",
            "6,0-6"
        ],
        [
            "2-4,0",
            "4,1-3"
        ],
        [
            "0,1-2",
            "1-3,2"
        ],
        [
            "0,5-6",
            "1,4-5"
        ],
        [
            "0,4",
            "0-2,3",
            "2,4",
            "2-5,5"
        ],
        [
            "0-1,0",
            "1-3,1"
        ]
    ]
}